<?xml version="1.0" encoding="UTF-8"?>
<!DOCTYPE OLDL PUBLIC "-//OLDL 0.4//EN" "http://doctype.open-lims.org/oldl.dtd" >
<OLDL type="sample">
	<HEAD>
		<ID>20120</ID>
	 	<TITLE>Microscopy Specimen - Live Imaging</TITLE>
		<DESC>Template for live-imaging microscopy coverslip</DESC>
		<VERSION>draft</VERSION>
		<AUTHOR></AUTHOR>
	</HEAD>
	<REQUIRED>
		<ITEM type="value">
          <TYPE id="20103"></TYPE>
    	</ITEM>
	</REQUIRED>
	<BODY>
     	<ITEM type="parentsample" requirement="optional" occurrence="multiple" inherit="all">
     	</ITEM>      
	</BODY>
</OLDL>