<?xml version="1.0" encoding="UTF-8"?>
<!DOCTYPE OLDL PUBLIC "-//OLDL 0.4//EN" "http://doctype.open-lims.org/oldl.dtd" >
<OLDL type="sample">
	<HEAD>
		<ID>101</ID>
	 	<TITLE>General w. Date of Expiry</TITLE>
		<DESC>General Sample Template</DESC>
		<VERSION>draft</VERSION>
		<AUTHOR></AUTHOR>
		<LOCATION requirement="optional" />
		<MANUFACTURER requirement="optional" />
		<EXPIRY />
	</HEAD>
	<BODY>
      	<ITEM type="parameter">
	 	</ITEM> 
	</BODY>
</OLDL>
